{
  "schema_version": 1,
  "name": "archive-replay",
  "audience": "Productions requiring recording, clipping, and replay",
  "core": {
    "repository": "https://github.com/guycochran/mxl-switcher-core",
    "ref": "main"
  },
  "extensions": [
    "recording/file-recorder",
    "recording/tams"
  ],
  "notes": [
    "The initial gate records Program only; playback, trim/export, and replay have separate later gates.",
    "The original prototype did not establish dependable playback or trimming.",
    "TAMS service and object storage are independently deployed."
  ]
}
